{"evaluation_id":"P-02-HC-0002-MASKED-001","role":"power_auditor","role_contract_version":"0.1","run_metadata":{"provider":"file-backed-fixture","model":"deterministic-fixture","model_version":"0.1","prompt_or_contract_digest":"role-contracts-v0.1","run_id":"P-02-HC-0002-MASKED-001"},"findings":[{"finding_id":"POW-1","statement":"Management has schedule, cost and reputational incentives that favour approval while also controlling the safety decision.","basis":"input_evidence","evidence_ids":["E6"],"materiality":"high"},{"finding_id":"POW-2","statement":"Engineering dissent exists and a senior representative proposes waiting, yet management can reverse the no-go recommendation.","basis":"input_evidence","evidence_ids":["E2","E7"],"materiality":"high"},{"finding_id":"POW-3","statement":"Delay and escalation are less irreversible exercises of power than authorizing the mission now.","basis":"constitutional_interpretation","evidence_ids":["E7"],"materiality":"decisive"}],"principle_assessments":[{"principle_id":"MC-10","status":"fail","reason":"Approval now uses irreversible authority when reversible alternatives can address the same mission objective.","evidence_ids":["E1","E5","E7"],"potential_moral_floor_breach":false},{"principle_id":"MC-11","status":"fail","reason":"The conflict between safety responsibility and schedule pressure plus unresolved dissent requires independent or higher-level scrutiny.","evidence_ids":["E6","E7"],"potential_moral_floor_breach":false},{"principle_id":"MC-12","status":"concern","reason":"The process must preserve the practical force of engineering challenge rather than treating management authority as decisive evidence.","evidence_ids":["E2","E7"],"potential_moral_floor_breach":false}],"information_requests":["What independent escalation route exists when contractor management reverses engineering no-go advice?"],"alternatives_or_safeguards":["Escalate dissent; delay; require explicit safety-signoff based on evidence rather than schedule need."],"evidence_that_could_change_view":["Independent technical review resolving the material uncertainty in favour of safety."],"recommended_disposition":"insufficient_evidence"}
